,keyword,intent,use_case
0,tree removal sarasota,transactional,service page H1/title
1,tree removal near me sarasota,local,location section / FAQ
2,emergency tree removal sarasota fl,urgent,storm LP / CTA module
3,tree removal cost sarasota,commercial investigation,pricing/FAQ
4,licensed insured tree removal sarasota,trust,trust badges / bullets
5,tree removal bradenton,transactional,service page H1/title
6,tree removal near me bradenton,local,location section / FAQ
7,emergency tree removal bradenton fl,urgent,storm LP / CTA module
8,tree removal cost bradenton,commercial investigation,pricing/FAQ
9,licensed insured tree removal bradenton,trust,trust badges / bullets
10,tree removal palmetto,transactional,service page H1/title
11,tree removal near me palmetto,local,location section / FAQ
12,emergency tree removal palmetto fl,urgent,storm LP / CTA module
13,tree removal cost palmetto,commercial investigation,pricing/FAQ
14,licensed insured tree removal palmetto,trust,trust badges / bullets
15,tree removal venice,transactional,service page H1/title
16,tree removal near me venice,local,location section / FAQ
17,emergency tree removal venice fl,urgent,storm LP / CTA module
18,tree removal cost venice,commercial investigation,pricing/FAQ
19,licensed insured tree removal venice,trust,trust badges / bullets
20,tree removal lakewood ranch,transactional,service page H1/title
21,tree removal near me lakewood ranch,local,location section / FAQ
22,emergency tree removal lakewood ranch fl,urgent,storm LP / CTA module
23,tree removal cost lakewood ranch,commercial investigation,pricing/FAQ
24,licensed insured tree removal lakewood ranch,trust,trust badges / bullets
25,tree removal longboat key,transactional,service page H1/title
26,tree removal near me longboat key,local,location section / FAQ
27,emergency tree removal longboat key fl,urgent,storm LP / CTA module
28,tree removal cost longboat key,commercial investigation,pricing/FAQ
29,licensed insured tree removal longboat key,trust,trust badges / bullets
30,tree removal siesta key,transactional,service page H1/title
31,tree removal near me siesta key,local,location section / FAQ
32,emergency tree removal siesta key fl,urgent,storm LP / CTA module
33,tree removal cost siesta key,commercial investigation,pricing/FAQ
34,licensed insured tree removal siesta key,trust,trust badges / bullets
35,tree removal parrish,transactional,service page H1/title
36,tree removal near me parrish,local,location section / FAQ
37,emergency tree removal parrish fl,urgent,storm LP / CTA module
38,tree removal cost parrish,commercial investigation,pricing/FAQ
39,licensed insured tree removal parrish,trust,trust badges / bullets
40,tree removal port charlotte,transactional,service page H1/title
41,tree removal near me port charlotte,local,location section / FAQ
42,emergency tree removal port charlotte fl,urgent,storm LP / CTA module
43,tree removal cost port charlotte,commercial investigation,pricing/FAQ
44,licensed insured tree removal port charlotte,trust,trust badges / bullets
45,tree removal nokomis,transactional,service page H1/title
46,tree removal near me nokomis,local,location section / FAQ
47,emergency tree removal nokomis fl,urgent,storm LP / CTA module
48,tree removal cost nokomis,commercial investigation,pricing/FAQ
49,licensed insured tree removal nokomis,trust,trust badges / bullets
